SQL> connect system
Enter password:
Connected.
SQL> create table emp(empno NUMBER,empname VARCHAR(255),DOB DATE,salary NUMBER,deignation VARCHAR(20));

Table created.

SQL> insert into emp values(100,'John','21-Apr-1996',50000,'Manager');

1 row created.
SQL> insert into emp values(101,'Greg','20-July-1994',2500,'Clerk');

1 row created.

SQL> insert into emp values(102,'Dan','27-May-1999',30000,'Asst.Manager');

1 row created.
SQL> desc emp
 Name                                      Null?    Type
 ----------------------------------------- -------- ----------------------------
 EMPNO                                              NUMBER
 EMPNAME                                            VARCHAR2(255)
 DOB                                                DATE
 SALARY                                             NUMBER
 DEIGNATION                                         VARCHAR2(20)
SQL> select *from emp;

     EMPNO
----------
EMPNAME
--------------------------------------------------------------------------------
DOB           SALARY DEIGNATION
--------- ---------- --------------------
       100
John
21-APR-96      50000 Manager

       101
Greg
20-JUL-94       2500 Clerk

     EMPNO
----------
EMPNAME
--------------------------------------------------------------------------------
DOB           SALARY DEIGNATION
--------- ---------- --------------------

       102
Dan
27-MAY-99      30000 Asst.Manager


SQL> select empname,salary from emp;

EMPNAME
--------------------------------------------------------------------------------
    SALARY
----------
John
     50000

Greg
      2500

Dan
     30000


SQL> update emp set salary=salary+1000;

3 rows updated.

SQL> delete from emp where empno=100;

1 row deleted.

SQL> alter table emp add department VARCHAR(50);

Table altered.

SQL> desc emp;
 Name                                      Null?    Type
 ----------------------------------------- -------- ----------------------------
 EMPNO                                              NUMBER
 EMPNAME                                            VARCHAR2(255)
 DOB                                                DATE
 SALARY                                             NUMBER
 DEIGNATION                                         VARCHAR2(20)
 DEPARTMENT                                         VARCHAR2(50)

SQL> alter table emp modify department VARCHAR(100);

Table altered.
SQL> alter table emp rename to emp1;

Table altered.

SQL> desc emp1;
 Name                                      Null?    Type
 ----------------------------------------- -------- ----------------------------
 EMPNO                                              NUMBER
 EMPNAME                                            VARCHAR2(255)
 DOB                                                DATE
 SALARY                                             NUMBER
 DEIGNATION                                         VARCHAR2(20)
 DEPARTMENT                                         VARCHAR2(100)
SQL> drop table emp1;

Table dropped.

SQL> desc emp1;
ERROR:
ORA-04043: object emp1 does not exist
